chart_id,file_name,business_question,chart_type,key_finding,limitation
01,01_category_bar.png,不同城市等级的用户流失率有何差异？,bar,二线城市用户流失率最高（34.3%），一线城市最低（15.5%）,二线城市样本量较小，结论稳定性需注意；仅展示相关性，无法证明因果
02,02_behavior_scatter.png,用户订单数与返现金额之间存在怎样的关系？,scatter,订单数与返现金额呈正相关，已流失用户多集中在低订单数、低返现区域,相关关系不等于因果关系；数据存在重叠，部分细节不够清晰
03,03_ordered_line.png,不同使用时长阶段的用户流失率呈现怎样的变化趋势？,line,流失率随使用时长增加显著下降，新用户流失率53.5%，24个月以上为0%,这是有序阶段比较，不是时间趋势；24个月以上样本量较小
04,04_composition_chart.png,用户满意度评分的整体构成分布如何？,pie,满意度分布较为均匀，3分和4分占比最高（合计46.9%）,不适合进行类别间精确数值比较；满意度是主观指标，可能存在偏差
05,day06_visualization_summary.png,整体概览,dashboard,综合展示了城市等级、用户行为、使用时长和满意度四个维度的流失相关特征,子图空间有限，细节信息展示不够充分
